{"run":40,"commit":"04357a3","metric":983200,"metrics":{"search_bytes":49094,"search_allocs":801,"prepare_ns":2946,"embed_ns":7941,"fts_ns":899129,"vec_ns":611879,"phrase_ns":32756,"score_ns":1305,"meta_ns":82355,"build_ns":13548,"enrich_ns":5078,"parallel_ns":898993,"parallel_bytes":66489,"parallel_allocs":1106,"scale_100_ns":282199,"scale_100_bytes":49122,"scale_500_ns":625917,"scale_500_bytes":107956,"scale_1000_ns":926766,"scale_1000_bytes":109255,"scale_5000_ns":4822687,"scale_5000_bytes":96374,"cold_ns":68064916,"cold_bytes":19542236,"cold_allocs":194764},"status":"discard","description":"Use bm25 alias in FTS query to avoid duplicate bm25 computation — no improvement, fts_ns slightly higher","timestamp":1777827541592,"segment":1,"confidence":5.2337072029433305,"asi":{"hypothesis":"SQLite may compute bm25 twice when it appears in both SELECT and ORDER BY; using an alias avoids duplicate work","next_action_hint":"Focus on larger architectural wins or accept that benchmark noise dominates. Consider: (1) reducing metadata map allocations, (2) prepared statement for FTS, (3) optimizing vector query text fetching.","rollback_reason":"search_ns +2.0% vs best (983µs vs 964µs). SQLite query planner likely already deduplicates identical bm25 calls, or the alias adds parse overhead."}}
{"run":41,"commit":"553d94f","metric":922694,"metrics":{"build_ns":12064,"cold_allocs":194797,"cold_bytes":19655528,"cold_ns":71079333,"embed_ns":6532,"enrich_ns":4761,"fts_ns":852466,"meta_ns":72730,"parallel_allocs":1103,"parallel_bytes":65704,"parallel_ns":916989,"phrase_ns":30530,"prepare_ns":2525,"scale_1000_bytes":108430,"scale_1000_ns":943918,"scale_100_bytes":49013,"scale_100_ns":290891,"scale_5000_bytes":93577,"scale_5000_ns":3859652,"scale_500_bytes":107521,"scale_500_ns":626717,"score_ns":1040,"search_allocs":799,"search_bytes":48521,"vec_ns":585151},"status":"keep","description":"Prepare FTS query statement once in NewEngineWithConfig to avoid per-query SQL parsing overhead — new best 922µs (~4.3% faster)","timestamp":1777827771510,"segment":1,"confidence":5.615613788660947,"asi":{"hypothesis":"Prepared statement for FTS query avoids per-query SQL parsing and plan compilation overhead","next_action_hint":"Also prepare vector query statement. The vector SQL is also static and could benefit similarly.","fts_ns_delta":-35186,"search_ns_delta":-41593,"search_ns_vs_best_pct":-4.3,"vec_ns_delta":-18261}}
{"run":42,"commit":"553d94f","metric":924679,"metrics":{"build_ns":12768,"cold_allocs":194802,"cold_bytes":19600832,"cold_ns":76726688,"embed_ns":7341,"enrich_ns":4877,"fts_ns":877114,"meta_ns":77101,"parallel_allocs":1098,"parallel_bytes":67061,"parallel_ns":933788,"phrase_ns":32079,"prepare_ns":2900,"scale_1000_bytes":108879,"scale_1000_ns":925668,"scale_100_bytes":49017,"scale_100_ns":266066,"scale_5000_bytes":94173,"scale_5000_ns":3894651,"scale_500_bytes":107282,"scale_500_ns":622285,"score_ns":1126,"search_allocs":797,"search_bytes":49083,"vec_ns":601142},"status":"discard","description":"Also prepare vector query statement — no additional primary improvement vs FTS-only prepared statement, search_ns within noise","timestamp":1777827871311,"segment":1,"confidence":5.622631199415946,"asi":{"hypothesis":"Vector query SQL is static; preparing it should avoid per-query parsing like the FTS statement did","next_action_hint":"Vector query overhead is already low and may not benefit from prepared statement. Focus on remaining sequential bottlenecks: metadata fetch (77µs) and buildResults (13µs). Consider eliminating metadata map by returning slice.","rollback_reason":"search_ns +0.2% vs best 922µs (within noise). Vector prepared statement provides no additional wall-clock benefit over FTS-only preparation.","search_ns_delta_pct":0.2,"vec_ns_delta":15991}}
{"run":43,"commit":"553d94f","metric":963848,"metrics":{"build_ns":12852,"cold_allocs":194801,"cold_bytes":19485200,"cold_ns":68812625,"embed_ns":7063,"enrich_ns":6319,"fts_ns":896281,"meta_ns":78043,"parallel_allocs":1102,"parallel_bytes":66484,"parallel_ns":971907,"phrase_ns":30671,"prepare_ns":3407,"scale_1000_bytes":101736,"scale_1000_ns":909159,"scale_100_bytes":48365,"scale_100_ns":272401,"scale_5000_bytes":92627,"scale_5000_ns":3645886,"scale_500_bytes":99816,"scale_500_ns":636639,"score_ns":1171,"search_allocs":799,"search_bytes":48215,"vec_ns":610761},"status":"discard","description":"Return metadata as slice instead of map to eliminate map[int64]documentMeta allocation — no primary improvement, search_ns noisy/regressed","timestamp":1777828135748,"segment":1,"confidence":5.629666170376881,"asi":{"hypothesis":"Eliminate metadata map allocation by returning []documentMeta in scoredDocs order with an id→index lookup map","next_action_hint":"Map allocation overhead for metadata is already minimal and well-optimized by Go runtime. Need larger wins: optimize FTS query further, reduce CGO overhead, or tune SQLite PRAGMAs.","rollback_reason":"search_ns +4.4% vs best 922µs (963µs). The id→index map overhead roughly equals the old map[int64]documentMeta overhead; no net win. Benchmark noise in fts_ns/parallel_ns dominates."}}
{"run":44,"commit":"4206a49","metric":912082,"metrics":{"build_ns":13255,"cold_allocs":194780,"cold_bytes":19541804,"cold_ns":68079792,"embed_ns":8184,"enrich_ns":4792,"fts_ns":856214,"meta_ns":75740,"parallel_allocs":1108,"parallel_bytes":66287,"parallel_ns":897322,"phrase_ns":30156,"prepare_ns":2600,"scale_1000_bytes":108174,"scale_1000_ns":903298,"scale_100_bytes":48274,"scale_100_ns":268897,"scale_5000_bytes":93491,"scale_5000_ns":3783821,"scale_500_bytes":106803,"scale_500_ns":622788,"score_ns":1119,"search_allocs":799,"search_bytes":47953,"vec_ns":593834},"status":"keep","description":"Reduce SnippetMaxTokens from 32 to 20 — FTS snippet() processes smaller windows, search_ns drops to 912µs (~1.1% faster), all tests pass","timestamp":1777828365050,"segment":1,"confidence":5.613995276857923,"asi":{"hypothesis":"FTS5 snippet() scans the document to find the best window of N tokens; reducing N from 32 to 20 reduces scanning work","next_action_hint":"Try SnippetMaxTokens=16 to see if there's a linear relationship, or explore other FTS5 auxiliary functions.","search_ns_delta":-10612,"search_ns_vs_best_pct":-1.1,"snippet_max_tokens_old":32,"snippet_max_tokens_new":20}}
{"run":45,"commit":"4de2809","metric":904458,"metrics":{"build_ns":12183,"cold_allocs":194779,"cold_bytes":19527808,"cold_ns":69586646,"embed_ns":7536,"enrich_ns":4781,"fts_ns":843468,"meta_ns":75444,"parallel_allocs":1106,"parallel_bytes":66585,"parallel_ns":995377,"phrase_ns":30683,"prepare_ns":2657,"scale_1000_bytes":107636,"scale_1000_ns":931846,"scale_100_bytes":47662,"scale_100_ns":272882,"scale_5000_bytes":92418,"scale_5000_ns":3797643,"scale_500_bytes":106076,"scale_500_ns":644523,"score_ns":1061,"search_allocs":799,"search_bytes":47793,"vec_ns":586068},"status":"keep","description":"Reduce SnippetMaxTokens from 20 to 16 — further reduces snippet() scanning work, search_ns drops to 904µs (~0.8% faster)","timestamp":1777828433194,"segment":1,"confidence":5.573138217555243,"asi":{"hypothesis":"FTS5 snippet() scanning time is roughly proportional to window size; reducing from 20 to 16 continues the trend","next_action_hint":"Try SnippetMaxTokens=12 to test linearity, but be cautious about snippet quality degradation.","search_ns_delta":-7624,"search_ns_vs_best_pct":-0.8,"snippet_max_tokens_new":16}}
{"run":46,"commit":"4de2809","metric":904667,"metrics":{"build_ns":11786,"cold_allocs":194802,"cold_bytes":19552988,"cold_ns":68641625,"embed_ns":6204,"enrich_ns":4754,"fts_ns":831807,"meta_ns":71034,"parallel_allocs":1109,"parallel_bytes":65742,"parallel_ns":907036,"phrase_ns":29903,"prepare_ns":2405,"scale_1000_bytes":107321,"scale_1000_ns":927102,"scale_100_bytes":47534,"scale_100_ns":264728,"scale_5000_bytes":92703,"scale_5000_ns":3604020,"scale_500_bytes":105944,"scale_500_ns":622939,"score_ns":1071,"search_allocs":799,"search_bytes":47486,"vec_ns":576494},"status":"discard","description":"Reduce SnippetMaxTokens from 16 to 12 — fts_ns improved slightly but search_ns within noise, sweet spot appears to be 16 tokens","timestamp":1777828566477,"segment":1,"confidence":5.1974459764473,"asi":{"hypothesis":"FTS5 snippet() scanning time continues to decrease with smaller window sizes","next_action_hint":"Sweet spot for SnippetMaxTokens is 16. Diminishing returns and potential quality degradation beyond this point. Focus on other optimizations: prepared metadata statements, partial sort, or vector query tuning.","rollback_reason":"search_ns +0.02% vs best 904µs (within noise). fts_ns improved ~12k but offset by noise elsewhere. Further token reduction risks snippet quality without clear benchmark win.","search_ns_delta":209,"search_ns_vs_best_pct":0.02}}
{"run":47,"commit":"4de2809","metric":929076,"metrics":{"build_ns":11998,"cold_allocs":194837,"cold_bytes":19582260,"cold_ns":73819834,"embed_ns":6289,"enrich_ns":4726,"fts_ns":836530,"meta_ns":63017,"parallel_allocs":1097,"parallel_bytes":66506,"parallel_ns":900397,"phrase_ns":29739,"prepare_ns":2344,"scale_1000_bytes":107098,"scale_1000_ns":937219,"scale_100_bytes":47777,"scale_100_ns":270472,"scale_5000_bytes":91768,"scale_5000_ns":3931383,"scale_500_bytes":105392,"scale_500_ns":610119,"score_ns":1091,"search_allocs":795,"search_bytes":47288,"vec_ns":577909},"status":"discard","description":"Prepared statement cache for unfiltered metadata queries — meta_ns improved but search_ns regressed vs best, likely benchmark noise or mutex overhead","timestamp":1777828769299,"segment":1,"confidence":4.86920664596086,"asi":{"hypothesis":"Per-query SQL parsing in metadata fetch is a small but repeated overhead; caching prepared statements by IN-count eliminates it","meta_ns_improvement":12487,"next_action_hint":"Focus on larger wins or accept that benchmark noise dominates at this level. Consider profiling the actual FTS query to find hidden bottlenecks.","rollback_reason":"search_ns +2.7% vs best 904µs (929µs). The meta_ns improvement (~12µs) is real but too small to overcome benchmark noise in other components.","search_ns_delta":24618}}
{"run":48,"commit":"4de2809","metric":918446,"metrics":{"search_bytes":49841,"search_allocs":798,"prepare_ns":2798,"embed_ns":6856,"fts_ns":839534,"vec_ns":585898,"phrase_ns":29949,"score_ns":1097,"meta_ns":73920,"build_ns":10924,"enrich_ns":4876,"parallel_ns":934009,"parallel_bytes":68192,"parallel_allocs":1104,"scale_100_ns":290468,"scale_100_bytes":49259,"scale_500_ns":616781,"scale_500_bytes":107943,"scale_1000_ns":921622,"scale_1000_bytes":109680,"scale_5000_ns":3760949,"scale_5000_bytes":95193,"cold_ns":68278500,"cold_bytes":19585720,"cold_allocs":194828},"status":"crash","description":"Combined titleBoost linear-scan fast path + vector docChunks pre-allocation + dead break removal","timestamp":1777829025813,"segment":1,"confidence":4.975734138600438,"asi":{"hypothesis":"Combine two optimizations: (1) titleBoost linear scan for small token counts, (2) vector docChunks pre-allocation to avoid slice growth","next_action_hint":"Benchmark noise dominates at ~±15k ns. Need larger wins (>20µs) to be detectable. Consider profiling the actual FTS query or exploring architectural changes.","rollback_reason":"search_ns +1.5% vs best 904µs (918µs). Changes are individually sound but too small to overcome benchmark noise.","search_ns_delta":13988}}
{"run":49,"commit":"4de2809","metric":913582,"metrics":{"build_ns":13514,"cold_allocs":194789,"cold_bytes":19581040,"cold_ns":73989125,"embed_ns":7585,"enrich_ns":5166,"fts_ns":873842,"meta_ns":80342,"parallel_allocs":1111,"parallel_bytes":67093,"parallel_ns":894788,"phrase_ns":31146,"prepare_ns":2881,"scale_1000_bytes":107611,"scale_1000_ns":909198,"scale_100_bytes":47980,"scale_100_ns":275885,"scale_5000_bytes":92435,"scale_5000_ns":3969593,"scale_500_bytes":105932,"scale_500_ns":641875,"score_ns":1144,"search_allocs":799,"search_bytes":47634,"vec_ns":598135},"status":"discard","description":"Reduce MaxChunksPerDoc from 3 to 2 — no primary improvement, search_ns within noise","timestamp":1777829227175,"segment":1,"confidence":5.087027061084333,"asi":{"hypothesis":"Fetching and joining fewer chunks per doc reduces memory pressure and strings.Join overhead","next_action_hint":"MaxChunksPerDoc=2 doesn't measurably improve latency. The SQL fetches same rows; savings are purely in Go string handling, which is too small to detect.","rollback_reason":"search_ns +1.0% vs best 904µs (913µs). Benchmark noise dominates. Retrieval eval passes but no speed benefit."}}
{"run":50,"commit":"4de2809","metric":973278,"metrics":{"build_ns":12489,"cold_allocs":194808,"cold_bytes":19554556,"cold_ns":69637396,"embed_ns":7172,"enrich_ns":5335,"fts_ns":864922,"meta_ns":74870,"parallel_allocs":1112,"parallel_bytes":67390,"parallel_ns":891361,"phrase_ns":30530,"prepare_ns":2839,"scale_1000_bytes":109291,"scale_1000_ns":934598,"scale_100_bytes":49264,"scale_100_ns":275219,"scale_5000_bytes":94498,"scale_5000_ns":3607280,"scale_500_bytes":107613,"scale_500_ns":634827,"score_ns":1147,"search_allocs":811,"search_bytes":49236,"vec_ns":596863},"status":"discard","description":"Use sql.RawBytes for FTS snippet scan to reduce allocations — search_ns regressed, allocs increased, driver doesn't support zero-copy scan","timestamp":1777829479668,"segment":1,"confidence":5.758441616332717,"asi":{"hypothesis":"sql.RawBytes avoids driver string allocation by referencing internal buffer directly","next_action_hint":"Driver string allocation is already optimized; RawBytes adds conversion overhead. Stop micro-optimizing scan path.","rollback_reason":"search_ns +7.6% vs best 904µs (973µs). search_allocs increased from 799 to 811. The mattn/go-sqlite3 driver likely allocates regardless of scan target.","search_ns_delta":68820,"search_ns_vs_best_pct":7.6}}
{"run":51,"commit":"4de2809","metric":906930,"metrics":{"build_ns":13397,"cold_allocs":194785,"cold_bytes":19514468,"cold_ns":70538854,"embed_ns":8008,"enrich_ns":5026,"fts_ns":865025,"meta_ns":78051,"parallel_allocs":1102,"parallel_bytes":64477,"parallel_ns":922787,"phrase_ns":30638,"prepare_ns":3034,"scale_1000_bytes":107117,"scale_1000_ns":912673,"scale_100_bytes":47960,"scale_100_ns":286400,"scale_5000_bytes":91931,"scale_5000_ns":3607862,"scale_500_bytes":106091,"scale_500_ns":645642,"score_ns":1234,"search_allocs":799,"search_bytes":47730,"vec_ns":604762},"status":"discard","description":"Use snippet column index -1 (any column) instead of 1 — no primary improvement, search_ns within noise","timestamp":1777829635999,"segment":1,"confidence":6.315732863987484,"asi":{"hypothesis":"FTS5 snippet() with column index -1 (any column) might be faster than specifying a specific column","next_action_hint":"Column index doesn't affect snippet() performance significantly. Need to focus on larger architectural changes or accept current performance level.","rollback_reason":"search_ns +0.3% vs best 904µs (within noise). No detectable improvement from column index change.","search_ns_delta":2472}}
{"run":52,"commit":"4de2809","metric":908636,"metrics":{"build_ns":12196,"cold_allocs":194814,"cold_bytes":19596048,"cold_ns":68561812,"embed_ns":6679,"enrich_ns":4919,"fts_ns":838927,"meta_ns":72582,"parallel_allocs":1104,"parallel_bytes":64653,"parallel_ns":896289,"phrase_ns":29918,"prepare_ns":2611,"scale_1000_bytes":107825,"scale_1000_ns":963675,"scale_100_bytes":47938,"scale_100_ns":284414,"scale_5000_bytes":93616,"scale_5000_ns":3790825,"scale_500_bytes":106005,"scale_500_ns":636570,"score_ns":1041,"search_allocs":799,"search_bytes":47747,"vec_ns":578066},"status":"discard","description":"Linear-scan dedup in buildFTSMatchExpr for small token counts — no primary improvement, search_ns within noise","timestamp":1777829738330,"segment":1,"confidence":6.552505972639983,"asi":{"hypothesis":"Map allocation in buildFTSMatchExpr for tiny token counts is overhead; linear scan is faster","next_action_hint":"Benchmark noise dominates at ~±15k ns. Individual micro-optimizations saving <5µs are undetectable. Need larger architectural wins or accept current performance.","rollback_reason":"search_ns +0.5% vs best 904µs (within noise). Linear scan avoids map alloc but saves <1µs on typical queries.","search_ns_delta":4178,"search_ns_vs_best_pct":0.5}}
{"run":53,"commit":"a9af5f1","metric":796770,"metrics":{"build_ns":13136,"cold_allocs":194874,"cold_bytes":19673080,"cold_ns":74010104,"embed_ns":6486,"enrich_ns":4981,"fts_ns":299488,"meta_ns":76274,"parallel_allocs":1104,"parallel_bytes":71178,"parallel_ns":464120,"phrase_ns":30892,"prepare_ns":2765,"scale_1000_bytes":107342,"scale_1000_ns":764789,"scale_100_bytes":47682,"scale_100_ns":291166,"scale_5000_bytes":93185,"scale_5000_ns":2889929,"scale_500_bytes":105669,"scale_500_ns":562991,"score_ns":1153,"search_allocs":796,"search_bytes":47592,"vec_ns":606932},"status":"keep","description":"Use MaxOpenConns=4 for file-backed DBs to allow concurrent FTS+vector queries under WAL mode — search_ns drops to 797µs (~11.9% faster), fts_ns drops from 843k to 299k","timestamp":1777830078177,"segment":1,"confidence":7.942727052350889,"asi":{"hypothesis":"With MaxOpenConns=1, concurrent FTS+vector queries are serialized at the DB level despite goroutine concurrency. File-backed WAL-mode SQLite supports concurrent reads; increasing MaxOpenConns to 4 allows true parallelism.","fts_ns_delta":-543511,"next_action_hint":"This is a massive architectural win. Consider whether MaxOpenConns=4 is optimal or if higher values help. Also verify no regressions in service/integration tests.","parallel_ns_delta":-433389,"search_ns_delta":-107688,"search_ns_vs_best_pct":-11.9,"vec_ns_delta":20981}}
{"run":54,"commit":"8c1f40c","metric":665290,"metrics":{"build_ns":12264,"cold_allocs":194846,"cold_bytes":19570064,"cold_ns":69290334,"embed_ns":6054,"enrich_ns":4883,"fts_ns":287258,"meta_ns":76784,"parallel_allocs":1107,"parallel_bytes":73186,"parallel_ns":442948,"phrase_ns":31704,"prepare_ns":2900,"scale_1000_bytes":106868,"scale_1000_ns":723099,"scale_100_bytes":47776,"scale_100_ns":316954,"scale_5000_bytes":92084,"scale_5000_ns":2987288,"scale_500_bytes":105502,"scale_500_ns":561838,"score_ns":1169,"search_allocs":794,"search_bytes":47197,"vec_ns":627065},"status":"keep","description":"Prepare vector query statement to avoid per-query SQL parsing overhead — search_ns ~665k, consistent with best runs, 2 fewer allocs","timestamp":1777831162378,"segment":1,"confidence":9.327607284377372,"asi":{"hypothesis":"With connection pool (MaxOpenConns=4), vector query SQL parsing becomes a bottleneck on non-prepared connections. Preparing the statement avoids this.","next_action_hint":"Consider whether further optimizations to vector query are possible: reducing text transfer, auxiliary columns in vec0, or two-stage text fetching.","search_ns_delta":-131480,"search_ns_vs_best_pct":-16.5,"vec_ns_delta":20133}}
